{
  "version": "v0.0.6",
  "release_notes_path": "docs/release/v0.0.6-release-notes.md",
  "risk_class": "TRUST_BOUNDARY",
  "repos": [
    {
      "name": "fornax-core",
      "owner": "horonomy",
      "sha": "09f132e6d05b8064e0d0953973378608230b7d10",
      "publishes_artifact": true
    }
  ],
  "evidence": [
    {
      "gate": "qa",
      "jira_key": "FORNX-401",
      "jira_url": "https://lightning-dust-mite.atlassian.net/browse/FORNX-401",
      "applies_to_repos": ["fornax-core"]
    },
    {
      "gate": "security",
      "jira_key": "FORNX-401",
      "jira_url": "https://lightning-dust-mite.atlassian.net/browse/FORNX-401",
      "applies_to_repos": ["fornax-core"]
    },
    {
      "gate": "docs",
      "jira_key": "FORNX-401",
      "jira_url": "https://lightning-dust-mite.atlassian.net/browse/FORNX-401",
      "applies_to_repos": []
    },
    {
      "gate": "stage",
      "jira_key": "FORNX-401",
      "jira_url": "https://lightning-dust-mite.atlassian.net/browse/FORNX-401",
      "applies_to_repos": []
    }
  ]
}
