{
  "version": "v0.0.9",
  "release_notes_path": "docs/release/v0.0.9-release-notes.md",
  "risk_class": "TRUST_BOUNDARY",
  "repos": [
    {
      "name": "fornax-core",
      "owner": "horonomy",
      "sha": "dfc5d2dcec9b8044ca1d425264466fafed0d18f8",
      "publishes_artifact": true
    },
    {
      "name": "fornax-cloud",
      "owner": "horonomy",
      "sha": "4bf3e4c101f6ef2246efd51ddef559f7df567a61",
      "publishes_artifact": true
    }
  ],
  "evidence": [
    {
      "gate": "qa",
      "jira_key": "FORNX-434",
      "jira_url": "https://lightning-dust-mite.atlassian.net/browse/FORNX-434",
      "applies_to_repos": []
    },
    {
      "gate": "security",
      "jira_key": "FORNX-437",
      "jira_url": "https://lightning-dust-mite.atlassian.net/browse/FORNX-437",
      "applies_to_repos": []
    },
    {
      "gate": "docs",
      "jira_key": "FORNX-430",
      "jira_url": "https://lightning-dust-mite.atlassian.net/browse/FORNX-430",
      "applies_to_repos": []
    },
    {
      "gate": "stage",
      "jira_key": "FORNX-438",
      "jira_url": "https://lightning-dust-mite.atlassian.net/browse/FORNX-438",
      "applies_to_repos": []
    }
  ]
}
